{
  "pipeline_schema_version": "3.0",
  "sample_id": "as-1",
  "scenario_id": "c_Q1.D03_P03_partial_0010_v3",
  "split": "VALIDATION",
  "origin": "SYNTHETIC",
  "human_review": "pending",
  "input": {
    "current_question": "다음은 고혈압입니다. 진단받은 적이 있으신지, 지금 약을 드시는지 알려 주세요.",
    "question_id": "Q1.D03",
    "state": {
      "Q1.D02.diagnosed": {
        "value": false,
        "status": "ANSWERED"
      },
      "Q1.D02.on_medication": {
        "value": false,
        "status": "ANSWERED"
      }
    },
    "user_utterance": "십 년 전에 고혈압 진단을 받았어요."
  },
  "expected": {
    "action": "REASK",
    "next_item": "Q1.D03",
    "reason": "MISSING",
    "targets": [
      "Q1.D03.on_medication"
    ],
    "values": [
      {
        "key": "Q1.D03.diagnosed",
        "precision": "exact",
        "save": true,
        "status": "ANSWERED",
        "value": true
      },
      {
        "key": "Q1.D03.on_medication",
        "precision": "unspecified",
        "save": false,
        "status": "MISSING",
        "value": null
      }
    ]
  }
}
